{
  "schema_version": 1,
  "record_id": "rollback:repair-plan-example:0001",
  "policy": "manifest",
  "world_id": "world:synthetic-staging",
  "task_id": "repair-agent:task:0001",
  "agent_id": "repair_agent:server",
  "owner_ref": "owner:synthetic-operator",
  "operation_label": "repair_agent.apply_candidate",
  "mutation_class": "repair",
  "bounds": {
    "min": {
      "x": 0,
      "y": 64,
      "z": 0
    },
    "max": {
      "x": 0,
      "y": 64,
      "z": 0
    }
  },
  "changed_positions": [
    {
      "x": 0,
      "y": 64,
      "z": 0
    }
  ],
  "previous_nodes": [
    {
      "pos": {
        "x": 0,
        "y": 64,
        "z": 0
      },
      "node": {
        "name": "example:repair_target",
        "param1": 0,
        "param2": 0
      }
    }
  ],
  "chunk": {
    "chunk_index": 0,
    "chunk_count": 1,
    "first_position_index": 0,
    "position_count": 1
  },
  "created_at": "2026-06-27T00:00:00Z",
  "storage_ref": "rollback://synthetic/repair-plan-example/0001",
  "audit_ref": "audit:repair-plan-example:0001"
}
